id,title,description,source,createdAt
OPS-1001,"Outbound truck delayed at gate 4","Carrier reported a 45 minute delay because the loading bay is blocked by another trailer.","Transport","2026-04-25T08:00:00Z"
OPS-1002,"Missing customs paperwork","Shipment to Germany is missing customs documents and cannot be marked ready for departure.","Admin Desk","2026-04-25T08:35:00Z"
OPS-1003,"Safety concern near dock 2","Operator reported an unsafe spill near dock 2 and asks whether loading should pause.","Warehouse","2026-04-25T09:05:00Z"
OPS-1004,"Customer escalation about late delivery","Client requests urgent help because a high-value shipment missed the planned departure.","Customer Support","2026-04-25T09:40:00Z"
OPS-1005,"Capacity issue for afternoon wave","The afternoon outbound wave has more volume than planned and may need another vehicle.","Shift Planning","2026-04-25T10:15:00Z"
